{
  "version": "test-cloud-atlas",
  "generatedAtUtc": "2026-05-06T00:00:00.000Z",
  "validAtUtc": "2026-05-06T00:00:00.000Z",
  "resolutionDeg": 1,
  "width": 4,
  "height": 3,
  "latitudeStartDeg": -1,
  "longitudeStartDeg": -2,
  "valuesEncoding": "uint8-cloud-cover-pct",
  "opticalDensityValuesEncoding": "uint8-cloud-water-density-proxy-pct",
  "source": {
    "kind": "provisional-fixture",
    "model": "unit-test",
    "provenance": "unit test fixture"
  },
  "values": [0, 25, 50, 75, 10, 35, 60, 85, 20, 45, 70, 100],
  "opticalDensityValues": [0, 10, 20, 35, 5, 18, 40, 68, 8, 24, 58, 100]
}
